{
   "$schema": "schema/lw_patch.json", 
    "name": "piano",
    "voices": [
        {
            "soundbank_index": 8,
            "glide": false,
            "glide_rate": 200,
            "detune": 0,
            "freq_detune": 0
       },
        {
            "soundbank_index": 8,
            "glide": false,
            "glide_rate": 200,
            "detune": 0,
            "freq_detune": 0
        },
        {
            "soundbank_index": 8,
            "glide": false,
            "glide_rate": 200,
            "detune": 0,
            "freq_detune": 0
        },
        {
            "soundbank_index": 8,
            "glide": false,
            "glide_rate": 200,
            "detune": 0,
            "freq_detune": 0
        },
        {
            "soundbank_index": 8,
            "glide": false,
            "glide_rate": 200,
            "detune": 0,
            "freq_detune": 0
        },
        {
            "soundbank_index": 8,
            "glide": false,
            "glide_rate": 200,
            "detune": 0,
            "freq_detune": 0
        },
        {
            "soundbank_index": 8,
            "glide": false,
            "glide_rate": 200,
            "detune": 0,
            "freq_detune": 0
        },
        {
            "soundbank_index": 8,
            "glide": false,
            "glide_rate": 200,
            "detune": 0,
            "freq_detune": 0
        }
    ],
    "envelops": [
        {
            "attack_time": 5,
            "decay_time": 50,
            "release_time": 250,
            "sustain_level": 80
        },
        {
            "attack_time": 5,
            "decay_time": 50,
            "release_time": 250,
            "sustain_level": 80
        },
        {
            "attack_time": 5,
            "decay_time": 50,
            "release_time": 250,
            "sustain_level": 80
        },
        {
            "attack_time": 5,
            "decay_time": 50,
            "release_time": 250,
            "sustain_level": 80
        },
        {
            "attack_time": 5,
            "decay_time": 50,
            "release_time": 250,
            "sustain_level": 80
        },
        {
            "attack_time": 5,
            "decay_time": 10,
            "release_time": 250,
            "sustain_level": 80
        },
        {
            "attack_time": 5,
            "decay_time": 50,
            "release_time": 250,
            "sustain_level": 80
        },
        {
            "attack_time": 5,
            "decay_time": 50,
            "release_time": 250,
            "sustain_level": 80
        }
    ],
    "lfos": [
        {
            "soundbank_index": 0,
            "time": 200
        },
        {
            "soundbank_index": 0,
            "time": 200
        },
        {
            "soundbank_index": 0,
            "time": 200
        },
        {
            "soundbank_index": 0,
            "time": 200
        }
    ],
    "filter_config": {
        "cutoff_frequency": 2000,
        "resonance": 0,
        "kind_of_filter": "Low",
        "enabled": false
    },
    "mixer_config": {
        "gain_voices": [
            10,
            10,
            10,
            10,
            10,
            10,
            10,
            10
        ],
        "gain_main": 50
    },
    "overdrive_config": {
        "threshold": 2000,
        "kind": "Softer",
        "enabled": false
    },
    "bitcrunch_config": {
        "enabled": false
    },
    "routering_config": {
        "voices_to_envelop": [
          0,
          1,
          2,
          3,
          4,
          5,
          6,
          7
        ],
        "lfo_to_voice": [
            {
                "voices": [
                    0,
                    1
                ],
                "enable": false
            },
            {
                "voices": [
                    1,
                    255
                ],
                "enable": false
            },
            {
                "voices": [
                    1,
                    255
                ],
                "enable": false
            },
            {
                "voices": [
                    1,
                    255
                ],
                "enable": false
            }
        ],
        "lfo_to_filter": false,
        "lfo_to_freq": false,
        "lfo_to_freq_amount": 0
    },
    "synth_config": {
        "mode": "OctoPoly"
    }
}